{
  "$defs": {
    "Estimate": {
      "additionalProperties": false,
      "description": "A duration estimate that always declares where it came from.",
      "properties": {
        "minutes": {
          "maximum": 1440,
          "minimum": 0,
          "title": "Minutes",
          "type": "integer"
        },
        "minutes_max": {
          "anyOf": [
            {
              "maximum": 1440,
              "minimum": 0,
              "type": "integer"
            },
            {
              "type": "null"
            }
          ],
          "default": null,
          "title": "Minutes Max"
        },
        "provenance": {
          "enum": [
            "user",
            "inferred",
            "default"
          ],
          "title": "Provenance",
          "type": "string"
        }
      },
      "required": [
        "minutes",
        "provenance"
      ],
      "title": "Estimate",
      "type": "object"
    },
    "SourceRef": {
      "additionalProperties": false,
      "description": "Pointer to an immutable source revision, optionally a span within it.",
      "properties": {
        "source_id": {
          "maxLength": 128,
          "minLength": 3,
          "title": "Source Id",
          "type": "string"
        },
        "source_version": {
          "minimum": 1,
          "title": "Source Version",
          "type": "integer"
        },
        "span_ref": {
          "anyOf": [
            {
              "type": "string"
            },
            {
              "type": "null"
            }
          ],
          "default": null,
          "title": "Span Ref"
        }
      },
      "required": [
        "source_id",
        "source_version"
      ],
      "title": "SourceRef",
      "type": "object"
    },
    "TaskState": {
      "enum": [
        "inbox",
        "ready",
        "in_progress",
        "blocked",
        "done",
        "canceled"
      ],
      "title": "TaskState",
      "type": "string"
    }
  },
  "$id": "https://metis.local/schemas/v1/Task.json",
  "$schema": "https://json-schema.org/draft/2020-12/schema",
  "additionalProperties": false,
  "properties": {
    "body": {
      "anyOf": [
        {
          "maxLength": 20000,
          "type": "string"
        },
        {
          "type": "null"
        }
      ],
      "default": null,
      "title": "Body"
    },
    "canceled_at": {
      "anyOf": [
        {
          "format": "date-time",
          "type": "string"
        },
        {
          "type": "null"
        }
      ],
      "default": null,
      "title": "Canceled At"
    },
    "completed_at": {
      "anyOf": [
        {
          "format": "date-time",
          "type": "string"
        },
        {
          "type": "null"
        }
      ],
      "default": null,
      "title": "Completed At"
    },
    "created_at": {
      "format": "date-time",
      "title": "Created At",
      "type": "string"
    },
    "deadline_at": {
      "anyOf": [
        {
          "format": "date-time",
          "type": "string"
        },
        {
          "type": "null"
        }
      ],
      "default": null,
      "title": "Deadline At"
    },
    "deadline_local_date": {
      "anyOf": [
        {
          "format": "date",
          "type": "string"
        },
        {
          "type": "null"
        }
      ],
      "default": null,
      "title": "Deadline Local Date"
    },
    "depends_on": {
      "items": {
        "maxLength": 128,
        "minLength": 3,
        "type": "string"
      },
      "title": "Depends On",
      "type": "array"
    },
    "duration_estimate": {
      "anyOf": [
        {
          "$ref": "#/$defs/Estimate"
        },
        {
          "type": "null"
        }
      ],
      "default": null
    },
    "id": {
      "maxLength": 128,
      "minLength": 3,
      "title": "Id",
      "type": "string"
    },
    "priority": {
      "default": 1,
      "maximum": 3,
      "minimum": 0,
      "title": "Priority",
      "type": "integer"
    },
    "project_id": {
      "anyOf": [
        {
          "maxLength": 128,
          "minLength": 3,
          "type": "string"
        },
        {
          "type": "null"
        }
      ],
      "default": null,
      "title": "Project Id"
    },
    "revision": {
      "default": 1,
      "minimum": 1,
      "title": "Revision",
      "type": "integer"
    },
    "schema_version": {
      "const": 1,
      "default": 1,
      "title": "Schema Version",
      "type": "integer"
    },
    "source_refs": {
      "items": {
        "$ref": "#/$defs/SourceRef"
      },
      "title": "Source Refs",
      "type": "array"
    },
    "source_unavailable": {
      "default": false,
      "title": "Source Unavailable",
      "type": "boolean"
    },
    "state": {
      "$ref": "#/$defs/TaskState",
      "default": "inbox"
    },
    "timezone": {
      "anyOf": [
        {
          "examples": [
            "America/New_York"
          ],
          "maxLength": 64,
          "minLength": 1,
          "type": "string"
        },
        {
          "type": "null"
        }
      ],
      "default": null,
      "title": "Timezone"
    },
    "title": {
      "maxLength": 500,
      "minLength": 1,
      "title": "Title",
      "type": "string"
    },
    "updated_at": {
      "format": "date-time",
      "title": "Updated At",
      "type": "string"
    },
    "user_edited_fields": {
      "items": {
        "type": "string"
      },
      "title": "User Edited Fields",
      "type": "array"
    },
    "user_id": {
      "maxLength": 128,
      "minLength": 1,
      "title": "User Id",
      "type": "string"
    }
  },
  "required": [
    "id",
    "user_id",
    "created_at",
    "updated_at",
    "title"
  ],
  "title": "Task",
  "type": "object",
  "x-contract-version": 1
}
