{
  "body": null,
  "canceled_at": "2026-10-06T09:00:00Z",
  "completed_at": null,
  "created_at": "2026-10-05T14:00:00Z",
  "deadline_at": null,
  "deadline_local_date": null,
  "depends_on": [],
  "duration_estimate": null,
  "id": "task_demo_register",
  "priority": 1,
  "project_id": null,
  "revision": 3,
  "schema_version": 1,
  "source_refs": [
    {
      "source_id": "src_demo_bloomberg",
      "source_version": 1,
      "span_ref": "span_002"
    }
  ],
  "source_unavailable": false,
  "state": "canceled",
  "timezone": null,
  "title": "Register for the Bloomberg event",
  "updated_at": "2026-10-06T09:00:00Z",
  "user_edited_fields": [],
  "user_id": "demo_authenticated_subject"
}
