{
  "body": null,
  "canceled_at": null,
  "completed_at": null,
  "created_at": "2026-10-05T14:00:00Z",
  "deadline_at": null,
  "deadline_local_date": "2026-10-12",
  "depends_on": [],
  "duration_estimate": {
    "minutes": 90,
    "minutes_max": 120,
    "provenance": "user"
  },
  "id": "task_demo_apply",
  "priority": 3,
  "project_id": null,
  "revision": 4,
  "schema_version": 1,
  "source_refs": [
    {
      "source_id": "src_demo_bloomberg",
      "source_version": 1,
      "span_ref": "span_002"
    }
  ],
  "source_unavailable": false,
  "state": "ready",
  "timezone": "America/New_York",
  "title": "Submit the application",
  "updated_at": "2026-10-06T10:00:00Z",
  "user_edited_fields": [
    "deadline_local_date"
  ],
  "user_id": "demo_authenticated_subject"
}
